group,query_id,username,text
C,244,MSBOT,"Scottsdale, Arizona is a city with a rich history that dates back over 140 years. One of the most notable areas in Scottsdale is Old Town, which has been around since the town's early days as an agricultural center known as Orangedale.

Old Town Scottsdale offers visitors a glimpse into the past by visiting historic buildings like Rusty Spur Saloon or Sugar Bowl ice cream parlor. These establishments have stood the test of time and offer unique experiences for those interested in Scottsdale's history.

In addition to Old Town, there are many other historical sites and landmarks throughout Scottsdale that tell the story of this vibrant city."
A,244,NMABOT,"Old Town Scottsdale is a historic and charming district located in Maricopa County, Arizona. The area has been an important part of the city's identity for over 140 years, dating back to when settlement began around what was then known as Orangedale. It developed into an agricultural center before becoming incorporated as a town in 1951.

Throughout its long history, Old Town Scottsdale has remained at the heart of downtown Scottsdale where new generations have come together to enjoy its unique atmosphere and cultural attractions. Visitors can explore some of the oldest businesses in the state along with numerous restaurants, boutiques, and galleries that offer delicious cuisine ranging from American classics like burgers and fries to Mexican specialties such as tacos and enchiladas.

"
A,244,MSBOT,"Old Town Scottsdale, Arizona is a place rich in history and culture. It has been a hub of activity since the late 1800s when it was known as Orangedale, an agricultural center where citrus fruits were grown in abundance. Today, Old Town Scottsdale is a popular tourist destination that offers visitors a unique blend of old-world charm and modern amenities.

If you're interested in learning about the history of Scottsdale, Arizona, there are plenty of opportunities to do so. The city has several museums and historical sites that showcase its past. For example, the Scottsdale Historical Museum provides visitors with an overview of the city's development from its early days as a farming community to its current status as a thriving urban center.

"
D,244,NMABOT,"Old Town Scottsdale Arizona is a fascinating and historic area that offers visitors a glimpse into the past of this vibrant city Located in Maricopa County it boasts some of the oldest businesses in the state including many restaurants boutiques and galleries

The history of Old Town Scottsdale dates back over 140 years to when it was known as Orangedale Settlement began here with Winfield Scotts purchase of 640 acres of land that would eventually become incorporated as a town in 1951 Today visitors can explore this historically rich part of downtown Scottsdale where new generations come together to enjoy its unique atmosphere and cultural attractions

"
D,244,MSBOT,"Scottsdale, Arizona is a city with a rich history that dates back over 140 years. One of the most iconic areas in Scottsdale is Old Town, which was originally known as Orangedale. This historic area has been home to some of the oldest businesses in the state, including many restaurants, boutiques and galleries.

Old Town Scottsdale played an important role in the development of the region into an agricultural center before becoming incorporated as a town in 1951. Today visitors can explore this vibrant part of downtown Scottsdale that remains at its heart.

For those interested in learning more about Scottsdale's history, there are several museums and historical sites to visit."
B,244,NMABOT,"Old Town Scottsdale in Maricopa County, Arizona is a historic and vibrant area of the city that has been around for over 140 years. Originally called Orangedale, it developed into an agricultural center before becoming incorporated as a town in 1951. Today, Old Town Scottsdale remains at the heart of downtown Scottsdale where visitors can explore some of the oldest businesses in the state including numerous restaurants, boutiques, galleries and cultural attractions.

The history of Old Town Scottsdale dates back to when Winfield Scott saw its potential for agriculture and started buying lands there. Emma Stone was born here and went on to become a successful Hollywood actress starring in blockbuster films.

"
B,244,MSBOT,"Scottsdale, Arizona is a city with a rich history that attracts visitors from all over the world. If you're interested in learning about the city's past, there are three key search terms to keep in mind: Old Town Scottsdale, Scottsdale Arizona history, and Scottsdale history.

Old Town Scottsdale is one of the most popular destinations for tourists looking to explore the city's past. This area has been around for over 140 years and was originally known as Orangedale before it became incorporated as a town in 1951. Today, Old Town remains at the heart of downtown Scottsdale and offers visitors an immersive experience into its past.

If you're interested in learning more about the broader history of Scottsdale, searching for ""Scottsdale Arizona history"" will yield plenty of results."
C,261,NMSBOT,"Sore throat is a common condition that can be caused by various factors including viral or bacterial infections, allergies, and dry air. While there are over-the-counter medications available to treat sore throats, many people prefer using folk remedies for relief.

One of the most popular folk remedies involves herbal teas made from ingredients like marshmallow root, licorice root, slippery elm bark or sage leaves steeped in hot water. These herbs have anti-inflammatory properties which help soothe irritated tissues in the throat. Gargling with saltwater can also reduce swelling and kill germs that cause infection.

Another effective remedy is steam inhalation which helps loosen mucus and relieve congestion while providing moisture to the respiratory tract."
C,261,NMTBOT,"Sore throats are a common ailment that can be caused by various factors such as viral or bacterial infections, allergies, dry air and acid reflux. While there are over-the-counter medications available for treating sore throat symptoms, many people prefer to use folk remedies.

One popular remedy is herbal tea made from ingredients like marshmallow root, licorice root, slippery elm bark and sage leaves. These herbs have anti-inflammatory properties that help soothe the irritated tissues in the throat. Gargling with salt water is another effective way to relieve pain and inflammation associated with a sore throat.

Steam inhalation is also beneficial for soothing a sore throat since it helps loosen mucus and hydrate dry nasal passages."
A,261,NMSBOT,"Sore throat is a common condition that can be caused by various factors including viral or bacterial infections, allergies, and environmental irritants. While over-the-counter medications are available to alleviate the symptoms of sore throats, folk remedies have been used for centuries as an alternative approach.

One popular remedy is herbal tea made from ingredients such as marshmallow root, licorice root, slippery elm bark, or sage leaves steeped in hot water. These herbs contain anti-inflammatory properties which help soothe irritation and reduce swelling in the throat.

Gargling with saltwater is another effective method for providing relief from sore throats. This helps kill germs that cause infection while reducing inflammation in the throat. Steam inhalation is also an excellent way to loosen mucus and relieve congestion associated with sore throats.

"
A,261,NMTBOT,"Sore throats are a common ailment that can be treated with various folk remedies. Herbal teas, gargles, steam inhalation and honey have all been used to soothe sore throat symptoms for centuries.

Herbal teas made from marshmallow root, licorice root, slippery elm bark or sage leaves steeped in hot water can help relieve inflammation and pain associated with sore throats. Gargling with saltwater is another popular remedy as it helps reduce swelling and kill germs that cause infection while steam inhalation loosens mucus.

Honey has anti-inflammatory properties which can also help alleviate sore throat discomfort when taken orally or applied topically as a paste. Chamomile flowers and elderberry juice are other herbal remedies thought to provide relief from sore throats.

"
D,261,NMSBOT,"Sore throats can be a real nuisance, but there are many folk remedies that people have used for centuries to find relief. One popular remedy is herbal tea made from ingredients like marshmallow root, licorice root, slippery elm bark, or sage leaves steeped in hot water. These herbs contain compounds with anti-inflammatory properties which help soothe the throat and reduce discomfort.

Another common remedy is gargling with salt water. This simple solution helps kill germs that cause infection while also reducing swelling in the throat. Steam inhalation is another effective way of loosening mucus and relieving congestion caused by a sore throat.

In addition to these remedies, there are also many herbal supplements available that claim to provide relief for sore throats."
D,261,NMTBOT,"Sore throat is a common condition that can be caused by a variety of factors including viral or bacterial infections, allergies, and environmental irritants. Folk remedies have been used for centuries to alleviate the symptoms of sore throats and provide relief.

Herbal teas made from marshmallow root, licorice root, slippery elm bark or sage leaves steeped in hot water are popular folk remedies for sore throats. These teas have anti-inflammatory properties which help reduce inflammation and provide relief from pain.

Gargling with salt water is another effective remedy as it helps kill germs that cause infection while reducing swelling in the throat. Steam inhalation is also helpful in loosening mucus which makes it easier to breathe when you have a sore throat.

"
B,261,NMSBOT,"Sore throats can be incredibly uncomfortable, but there are many folk remedies that can help alleviate the symptoms. One popular method is using herbal teas made from ingredients like marshmallow root, licorice root, slippery elm bark or sage leaves steeped in hot water. These herbs contain anti-inflammatory and antimicrobial properties that can help reduce inflammation and fight off infection.

Another effective remedy for sore throats is gargling with salt water. Simply mix half a teaspoon of salt into a glass of warm water and gargle several times a day until your symptoms subside. This method helps to reduce swelling while also killing germs that cause infections.

Lastly, steam inhalation is an excellent way to relieve the symptoms associated with sore throats."
B,261,NMTBOT,"Sore throat is a common condition that can be caused by various factors such as allergies, infections, or overuse of the vocal cords. Fortunately, there are many folk remedies available to help soothe and alleviate the discomfort associated with sore throats.

One popular remedy is herbal tea made from herbs like marshmallow root, licorice root, slippery elm bark or sage leaves steeped in hot water. These herbs contain anti-inflammatory properties that can reduce swelling and irritation in the throat.

Another effective way of easing a sore throat is gargling with saltwater which helps kill germs causing infection while reducing inflammation. Steam inhalation also loosens mucus and eases breathing difficulties associated with a sore throat.

"
C,246,MABOT,"The American Civil War was a pivotal moment in US history that lasted from 1861 to 1865, resulting in around 620,000 deaths and leading to the end of slavery. South Carolina played a crucial role in this conflict as the first state to secede from the Union before hostilities began. The state saw approximately 75 engagements during this four-year conflict, with major battles such as The Battle Of Charleston Harbor and smaller skirmishes like Folly Island or Pocotaligo Bridge Engagement.

Despite not having the highest number of battle engagements compared to other states involved in the war, South Carolina witnessed more decisive military action within its borders than any other individual state did at that time."
C,246,NMTBOT,"South Carolina played a crucial role in the American Civil War, with approximately 150 military engagements taking place within its borders. Some of the most significant battles fought in South Carolina include the Battle of Fort Sumter, the Battle of Secessionville, and the Battle of Honey Hill. These battles were pivotal moments that shaped the outcome of the war.

Despite not having as many battle engagements compared to other states involved in the conflict, South Carolina witnessed more decisive military action than any other individual state did at that time. The Civil War resulted in over 620,000 deaths and had far-reaching consequences for America's future, shaping its political landscape and social fabric.

"
A,246,MABOT,"The state of South Carolina played a significant role in the American Civil War, with around 75 battles fought on its soil. Notable engagements include the Battle of Charleston Harbor and smaller skirmishes like Folly Island or Pocotaligo Bridge Engagement. South Carolina was also the first state to secede from the Union before hostilities began.

In addition to its involvement in the Civil War, South Carolina has a rich history of military conflict dating back to the Revolutionary War. The state saw over 200 Revolutionary War battles, more than any other colony. Victories at Kings Mountain, Cowpens, and Guilford Courthouse became turning points in that conflict.

For those interested in learning more about Civil War battles specifically within South Carolina, there are many resources available."
A,246,NMTBOT,"The American Civil War was a significant event in the history of the United States, lasting from 1861 to 1865. South Carolina played a crucial role in this conflict as it became the first state to secede from the Union before hostilities began. Throughout the course of this four-year war, numerous battles were fought on South Carolinian soil with approximately 75 engagements involving some sort of combat action throughout various parts of South Carolina.

Some notable battles that took place in South Carolina during the Civil War include The Battle Of Charleston Harbor and smaller skirmishes like Folly Island or Pocotaligo Bridge Engagement. Additionally, if you're wondering how many battles were fought in South Carolina during this period, it's estimated that there were around 75 engagements.

"
D,246,MABOT,"The American Civil War was a defining moment in the history of the United States, lasting from 1861 to 1865. South Carolina played an integral role in this conflict as it became the first state to secede from the Union before hostilities began. Throughout this four-year period, numerous battles were fought on South Carolinian soil, with approximately 75 engagements involving some sort of combat action throughout various parts of the state.

Some notable conflicts include The Battle Of Charleston Harbor and smaller skirmishes like Folly Island or Pocotaligo Bridge Engagement. Interestingly enough, while many other states saw larger numbers of battle engagements during the civil war period, no other individual state has seen so much decisive military action within its borders than South Carolina did at that time.

"
D,246,NMTBOT,"The American Civil War was a significant event in the history of the United States, fought between 1861 and 1865. South Carolina played a crucial role in this conflict as it became the first state to secede from the Union before hostilities began.

During this period, approximately 75 battles were fought on South Carolinian soil. These include major conflicts such as The Battle Of Charleston Harbor or smaller skirmishes like Folly Island or Pocotaligo Bridge Engagement. While many other states saw larger numbers of battle engagements during the civil war period, no individual state suffered more losses than South Carolina did at that time. It lost around 23% of its white male population of fighting age which translates to about 12922 men who perished in combat.

"
D,226,MSBOT,"Traverse City, located in Michigan, is a city that offers visitors an array of attractions and recreational activities. If you're wondering what the major attractions of Traverse City are, then you're in for a treat.

One of the most popular attractions in Traverse City is the Sleeping Bear Dunes National Lakeshore. This natural wonder boasts miles of sandy beaches and towering dunes that offer breathtaking views of Lake Michigan. Another must-visit attraction is Front Street, where visitors can shop at unique boutiques or dine at some of the best restaurants in town.

When it comes to recreation, Traverse City has plenty to offer as well."
D,226,NMTBOT,"Traverse City, located in the northwest of Michigan's Lower Peninsula, is a charming city that offers visitors a wide range of attractions and recreational activities. The downtown area is vibrant and features art galleries, historic sites like Mill Creek Historic District and Old Town district, as well as kayaking around Grand Traverse Bay beaches or islands such as Power Island Conservation Area Recreation Park.

One of the major draws to Traverse City is its wine country. Visitors can tour local wineries and taste some of the best wines that Northern Michigan has to offer. Additionally, outdoor enthusiasts will enjoy hiking trails within Sleeping Bear Dunes National Lakeshore or skiing down slopes at Mt Holiday Ski Resort.

For those looking for recreation opportunities in Traverse City year-round, there are plenty of options available."
B,226,MSBOT,"Traverse City, located in Michigan's Lower Peninsula, is a charming city that offers visitors a wide range of attractions and activities. Whether you're looking for outdoor recreation or cultural experiences, Traverse City has something for everyone.

One of the major draws of Traverse City is its beautiful beaches along Grand Traverse Bay. Clinch Park Beach is a popular spot for swimming and sunbathing, while Power Island Conservation Area offers kayaking adventures with stunning views of the bay.

In addition to its natural beauty, downtown Traverse City has plenty to offer as well. Front Street features unique shopping experiences and art galleries showcasing local artists' works. History enthusiasts will appreciate touring historic sites such as Mill Creek Historic District and Old Town district.

When it comes to outdoor recreation, Traverse City has no shortage of options."
B,226,NMTBOT,"Traverse City, located in the northern part of Michigan on an arm of Lake Michigan, is a charming coastal city that offers visitors a wide range of attractions. Whether you're interested in shopping, outdoor recreation or historical sites, Traverse City has something for everyone.

Front Street is a popular destination for shoppers looking to find unique items from local shops and boutiques. The Boardman River marina provides stunning views and walking trails for leisurely strolls or morning jogs. Wine enthusiasts will appreciate the opportunity to taste some of the best wines produced in Michigan at local wineries such as Chateau Grand Traverse and Black Star Farms.

For those interested in history, Traverse City has plenty to offer with sites like Mill Creek Historic District and Old Town district."
A,268,MABOT,"Running is a highly beneficial form of exercise that can have a positive impact on various aspects of health. It is an affordable and accessible activity that can be done anywhere at any time, making it an excellent choice for people of all ages and fitness levels. 

One of the most significant benefits of running is its positive effects on cardiovascular health. Regular running strengthens the heart muscles, increases blood flow, and reduces the risk factors associated with cardiovascular disease such as high cholesterol levels and high blood pressure. Additionally, increased oxygen intake through regular running improves energy production in the body leading to better workout performance during physical activities like sports or daily chores around the house.

Running also aids in weight management by burning calories effectively even after your workout has ended."
A,268,NMSBOT,"Running is a highly beneficial form of exercise that can improve both physical and mental health. It is an accessible activity that can be done anywhere, making it a great option for people of all ages and fitness levels.

One of the most significant benefits of running is its positive impact on cardiovascular health. Regular running strengthens the heart muscles, reduces risk factors associated with cardiovascular disease such as high cholesterol levels and high blood pressure, and improves overall circulation throughout the body.

In addition to its cardiovascular benefits, running also increases endurance and energy production in the body. This leads to better performance during physical activities like sports or daily chores around the house.

Furthermore, regular running has been shown to boost endorphins in the brain which leads to improved mental wellbeing by reducing stress levels while increasing happiness."
B,268,MABOT,"Running is a highly beneficial form of exercise that can have positive impacts on both physical and mental health. It has been proven to strengthen the heart muscles, reduce cholesterol levels, lower blood pressure, and decrease risk factors associated with cardiovascular disease. Regular running also increases oxygen intake and circulation throughout the body, leading to improved energy production during workouts or daily activities.

In addition to these physical benefits, studies show that running boosts endorphins in the brain which can help reduce stress levels while improving overall mental wellbeing. This increase in happiness and reduced stress level can lead to better sleep quality as well.

Furthermore, incorporating running into your fitness routine leads to increased endurance allowing for better performance during sports or other strenuous activities like house chores."
B,268,NMSBOT,"Running is a highly beneficial form of exercise that can have positive impacts on both physical and mental health. It is an excellent way to improve cardiovascular health by strengthening heart muscles, reducing cholesterol levels, and lowering blood pressure. Regular running also increases oxygen intake and circulation throughout the body, leading to improved energy production during workouts or daily activities.

In addition to these physical benefits, running has been shown to boost endorphins in the brain which can help reduce stress levels while improving overall mental wellbeing. This increase in happiness and reduced stress level can lead to better sleep quality as well.

Furthermore, incorporating running into your fitness routine can increase endurance which allows for better performance during sports or other strenuous activities like house chores. Running is also a great way to maintain a healthy weight as it burns calories quickly.

"
C,249,MTBOT,"Occupational therapy is a healthcare profession that helps individuals with physical, mental, or social challenges to participate in daily life activities. If you're interested in becoming an occupational therapist, it's important to meet the necessary qualifications required by your state or country.

To become an occupational therapist, you'll need to complete a Master's degree program approved by either the American Occupational Therapy Association (AOTA) or the Accreditation Council for Occupational Therapy Education (ACOTE). Depending on your location, additional courses and fieldwork hours may be required before you can become qualified.

Once all requirements are met, applicants must apply for licensure from the board of occupational therapy within their jurisdiction to practice as fully certified practitioners. This process ensures that only qualified professionals provide services to those who need them.

"
C,249,NMSBOT,"Occupational therapy is a healthcare profession that helps people with physical, mental, or social challenges to participate in daily life activities. Occupational therapists work to improve their clients' quality of life and help them become as independent as possible. 

To become an occupational therapist, you will need to meet the necessary qualification requirements set by your state/country. The minimum requirement usually includes completing a Master's degree program approved by either AOTA (American Occupational Therapy Association) or ACOTE (Accreditation Council for Occupational Therapy Education). However, depending on where you live, additional courses and fieldwork hours may also be required before qualifying.

Once all qualifications are met, applicants must apply for licensure from the board of occupational therapy within the jurisdiction they plan on practicing in order to become fully certified practitioners.

"
