group,query_id,username,text
D,228,MTBOT,"Hawaiian volcanoes have a long and fascinating history, and the Hawaiian Volcano Observatories (HVO) play a crucial role in monitoring and understanding their dynamic environment. Since 1912, HVO has been tracking volcanic activity, collecting scientific data about current events as well as analyzing past phenomena to predict potential eruptions.

The observatory's roots go back to the late 19th century when geological surveys were conducted at Kilauea by James Dwight Dana before being commissioned by King Kalakaua in 1881. Over time, advances in technology have allowed researchers to develop increasingly sophisticated tools enabling them to track eruptions over time accurately.

The unique characteristics of each island's geology provide invaluable insight into both future and historical events related to volcanism on the islands."
D,228,NMTBOT,"Hawaiis volcanic history is a fascinating and unique story that has been unfolding for millions of years. The Hawaiian Volcano Observatories (HVO) have played an important role in monitoring this ongoing activity since 1912, tracking and predicting potential eruptions while collecting scientific data about current events as well as analyzing past volcano-related phenomena.

The observatory has a longstanding relationship with Hawaiis dynamic environment dating back to the late 19th century when James Dwight Dana conducted geological surveys at Kilauea before being commissioned by King Kalakaua in 1881. Since then, advances in technology have allowed researchers to develop increasingly sophisticated tools that allow them to track eruptions over time and understand the history of volcano behavior more accurately than ever before.

"
B,228,MTBOT,"The Hawaiian Volcano Observatories (HVO) have been at the forefront of monitoring and predicting volcanic activity on the islands since 1912. HVO collects scientific data about current events, tracks potential eruptions, and analyzes past phenomena related to volcanism. The observatory has a long history in recording Hawaiians' relationship with their dynamic environment.

HVO's earliest roots stretch back to the late 19th century when James Dwight Dana conducted geological surveys at Kilauea before being commissioned by King Kalakaua in 1881. Since then, advances in technology have allowed researchers to develop increasingly sophisticated tools that allow them to track eruptions over time and understand how magma behaves within these environments more accurately than ever before.

"
B,228,NMTBOT,"The Hawaiian Volcano Observatories (HVO) have been monitoring the volcanic activity of Hawaii's volcanoes since 1912. The observatory is responsible for tracking and predicting potential eruptions, collecting scientific data about current events, as well as analyzing past volcano-related phenomena. HVO has a long history in recording Hawaiians' relationship with their dynamic environment.

The earliest roots of HVO date back to the late 19th century when James Dwight Dana conducted geological surveys at Kilauea before being commissioned by King Kalakaua in 1881. Since then, advances in technology have allowed researchers to develop increasingly sophisticated tools that allow them to track eruptions over time and understand how magma behaves within these environments more accurately than ever before.

"
C,226,MSBOT,"Traverse City, located in Michigan, is a city that offers visitors an abundance of attractions and activities. If you're wondering what the major attractions of Traverse City are, look no further than its stunning beaches. The city boasts miles of sandy shores along Lake Michigan's Grand Traverse Bay, including Clinch Park Beach and Bryant Park Beach.

But there's more to Traverse City than just its beaches. Visitors can explore the city's vibrant downtown area with its unique shopping experiences on Front Street and numerous art galleries. History buffs will appreciate touring historic sites like Mill Creek Historic District or Old Town district for fascinating insights into the area's past.

For those looking for outdoor recreation opportunities in Traverse City, there are plenty of options available as well."
C,226,NMTBOT,"Traverse City, located in Michigan's Lower Peninsula, is a stunning coastal city that offers visitors an abundance of attractions and recreational activities. The natural beauty of Traverse City is one of its major attractions, with Sleeping Bear Dunes National Lakeshore and Grand Traverse Bay being popular destinations for hiking, biking, kayaking and fishing.

For those who prefer indoor activities or want to take a break from outdoor recreation, Traverse City has plenty to offer as well. Downtown Traverse City boasts art galleries where visitors can find unique pieces to take home as souvenirs. Additionally, the Dennos Museum Center showcases the city's rich history and art collection.

Traverse City also has a vibrant food and wine scene with local restaurants serving up delicious cuisine paired perfectly with award-winning wines from nearby wineries."
A,226,MSBOT,"Traverse City, located in Michigan, is a city that offers visitors an abundance of attractions and recreational activities. If you're wondering what the major attractions of Traverse City are, then look no further. One of the most popular destinations in Traverse City is Sleeping Bear Dunes National Lakeshore. This area boasts miles of sandy beaches and stunning views of Lake Michigan.

For those who love outdoor recreation, Traverse City has plenty to offer. The many lakes in the area provide opportunities for boating, fishing, and swimming. Additionally, there are numerous hiking trails throughout the region that offer breathtaking views.

If you're looking for things to do within the city itself, downtown Traverse City features art galleries and unique shops along Front Street."
A,226,NMTBOT,"Traverse City, Michigan is a picturesque coastal city that offers visitors an array of major attractions and recreational activities. For those who love shopping, Front Street is a must-visit destination with its unique shops selling everything from souvenirs to high-end clothing brands. Art enthusiasts will appreciate the downtown Traverse City galleries showcasing works by talented artists from around the region.

History buffs can explore historic sites such as Mill Creek Historic District or Old Town district to learn about significant events that have shaped this charming city's past. Wine lovers won't want to miss out on visiting local wineries where they can sample delicious wines made with locally grown grapes.

In addition to these attractions, Traverse City also boasts several recreational activities for visitors to enjoy."
C,212,NMABOT,"Home theater systems have become increasingly popular as people look to enhance their entertainment experience.  design a space for home theaters, one needs expertise in acoustics and proper furniture arrangement to maximize the viewing and listening experience. There are several kinds of home theaters available such as dedicated rooms with acoustic treatments, media or family rooms featuring projector setups and surround sound systems, or portable systems with wireless technology allowing users to move it between different locations in your house.

When considering a home theater system, there are many factors that need to be taken into account such as sound quality, video resolution, and overall setup. Components like soundbars, speakers, projectors and screens work together to provide exceptional audio and video output. It is important to find the right balance between cost-effectiveness and an immersive home theater experience.

"
C,212,NMTBOT,"Home theater systems have become increasingly popular as people look to enhance their entertainment experience. There are several types of home theaters available, including dedicated rooms with acoustic treatments, media or family rooms featuring projector setups and surround sound systems, or portable systems with wireless technology that can be moved between different locations in your house.

Designing a space for a home theater requires expertise in acoustics and proper furniture arrangement to maximize the viewing and listening experience. The placement of speakers and seating is crucial to ensure optimal viewing angles and audio quality. Additionally, adding sound-absorbing materials such as curtains or carpets can improve overall sound quality.

When considering a home theater system, there are many factors that need to be taken into account such as cost-effectiveness, video resolution, and overall setup."
A,212,NMABOT,"Home theater systems are becoming increasingly popular as people look to enhance their entertainment experience. A complete home theater system includes various components such as soundbars, speakers, projectors, and screens that ensure high-quality audio and video output. However, designing a space for your home theater requires an understanding of acoustics and proper furniture arrangement.

To create the perfect home theater room design, you need to consider acoustic requirements carefully while selecting top-notch components that deliver unparalleled entertainment experiences for years to come. There are several kinds of home theaters available including dedicated rooms with acoustic treatments or media/family rooms featuring projector setups and surround sound systems. You could also opt for portable systems with wireless technology allowing users to move it between different locations in your house.

"
A,212,NMTBOT,"Home theater systems have become increasingly popular as people look to enhance their entertainment experience. A comprehensive home theater system includes components such as soundbars, speakers, projectors, and screens that deliver high-quality audio and video.

Designing space for a home theater requires more than just purchasing the right equipment. It is important to understand acoustics and how furniture placement can affect sound quality in order to create an optimal viewing environment. By carefully selecting top-quality components and considering acoustic requirements of the room, you can create a home theater that delivers unparalleled entertainment experience for years to come.

There are several types of home theaters available depending on your preferences and needs. Dedicated rooms with acoustic treatments ensure optimal sound quality while media or family rooms featuring projector setups offer a more casual viewing experience."
D,212,NMABOT,"Creating a home theater system is a popular trend for those who want to enhance their entertainment experience A good home theater setup includes essential components such as soundbars speakers projectors and screens from top brands like Sony or Bose with cuttingedge technology

When designing your dedicated room or mediafamily room into a home theater space there are several factors to consider Rectangular spaces are preferred over cubical ones due to acoustic considerations while high ceiling spaces provide accessible places to hang a projector and install soundbars Lighting also plays an important role in creating the perfect ambiance of the space

"
D,212,NMTBOT,"Home theater systems are a great way to enjoy high-quality audio and video experiences in the comfort of your own home. When designing a space for your home theater, there are several factors to consider.

One important factor is the type of home theater system you want. There are several types available, including traditional systems with screens or projectors, surround sound systems, and portable systems that can be moved between locations in your house.

Another crucial aspect of designing a home theater space is acoustics. To create an immersive experience while watching movies or TV shows at home, it's essential to have balanced acoustics by using acoustic treatments such as panels or curtains placed strategically around the room.

Furniture placement is also important when designing a home theater space."
B,212,NMABOT,"Home theater systems have become increasingly popular as people seek to enhance their entertainment experience in the comfort of their own homes. A home theater system typically includes components such as soundbars, speakers, projectors, and screens that provide high-quality audio and video. When designing space for a home theater, it is important to understand the acoustics of the room and arrange furniture in a way that optimizes sound quality.

There are several kinds of home theaters available depending on your preferences. Dedicated rooms with acoustic treatments can be designed specifically for watching movies or listening to music without any distractions from outside noise. Alternatively, family rooms equipped with projector setups and surround sound systems offer an immersive viewing experience while also serving as multipurpose spaces.

"
B,212,NMTBOT,"Home theater systems are becoming increasingly popular as people seek to enhance their entertainment experience in the comfort of their own homes. These audiovisual systems aim to replicate a movie theatre's atmosphere and mood using high-quality consumer electronics such as soundbars, speakers, projectors, and screens.

When designing space for a home theater, it is essential to consider several factors that can impact your viewing experience. For instance, the screen or TV should be positioned at eye level so that viewers can watch comfortably without straining their necks. Additionally, ambient light can wash out pictures; hence you need curtains or shades with darker-colored walls to reduce natural lighting sources' effects.

There are four basic types of home theater audio systems available on the market today."
C,210,NMABOT,"Golf GPS devices and apps have become increasingly popular among golfers looking to improve their game. For iPhone users, there are several top-rated golf GPS apps specifically designed to provide real-time updates on course conditions and yardage information. One such option is an iPhone app that accurately computes shot distances on any course in the world, making it a sought-after application among golf enthusiasts.

When deciding which golf GPS device or application to purchase, it's essential to consider your individual needs based on playing style and budget constraints. Fortunately, with so many excellent applications now available across various platforms, you're sure to find something perfect for your individual playing style.

Overall, golf GPS devices and apps can be valuable tools for improving your game and enhancing your overall golfing experience."
C,210,NMSBOT,"Golf GPS devices have become an essential tool for golfers looking to improve their game. One of the most convenient options is an iPhone app that computes shot distances on any course around the world. These apps provide real-time updates regarding course conditions as well as yardage information, making it easier for golfers to make informed decisions about their shots.

There are several top-rated golf GPS apps available for iPhones, such as Golfshot and SwingU. These apps offer features like 3D flyovers of each hole, personalized club recommendations based on your playing history, and weather data integration. With these features, golfers can get a better understanding of the course they're playing on and make more accurate shots.

"
A,210,NMABOT,"Golf GPS devices and apps have become increasingly popular among golfers looking to improve their game. With a wide range of options available, it can be challenging to choose the best one for your needs. One great option is using an iPhone app that computes shot distances on any course in the world.

Additionally, there are several top-rated golf GPS apps specifically designed for iPhones that provide real-time updates regarding course conditions as well as yardage information. These apps allow you to easily track your shots and analyze your performance over time.

When selecting a golf GPS device or app, it's important to consider factors such as accuracy, battery life, ease of use, and cost before making a purchase."
A,210,NMSBOT,"Golf GPS devices and apps have become increasingly popular among golfers looking to improve their game. One great option is an iPhone app that can compute shot distances on any course in the world. Additionally, there are several highly-rated golf GPS apps designed specifically for iPhones that provide real-time updates regarding course conditions as well as yardage information.

When selecting a golf GPS device or app, it's important to consider factors such as accuracy, battery life, ease of use, and cost before making a purchase. With so many excellent applications now available across various platforms including Android and iOS devices like iPhones, you're sure to find something perfect for your individual playing style.

"
D,210,NMABOT,"Golf GPS devices have become an essential tool for golfers looking to improve their game. One of the most popular options is using an iPhone app that computes shot distances on any course in the world. There are also several highly-rated golf GPS apps specifically designed for iPhones that provide real-time updates regarding course conditions and yardage information.

When selecting a golf GPS device, it's important to consider factors such as ease of use, accuracy, battery life, and price point. Some devices offer additional features like hazard mapping or club recommendations based on previous shots.

Whether you're a beginner or a professional golfer, finding the best golf GPS device comes down to personal preference and playing style. Using an iPhone app can be convenient as it eliminates the need for additional hardware while providing accurate data about your shots.

"
D,210,NMSBOT,"Golf GPS devices have become an essential tool for golfers looking to improve their game and there are many options available to choose from. One popular choice is using an iPhone app that can compute shot distances on any course in the world. Additionally, there are several highly-rated golf GPS apps specifically designed for iPhones that provide real-time updates regarding course conditions as well as yardage information.

When selecting a golf GPS device, it's important to consider factors such as ease of use, accuracy, battery life, and price point. Some devices offer additional features like hazard mapping or club recommendations based on previous shots.

Ultimately, finding the best golf GPS device comes down to personal preference and playing style."
B,210,NMSBOT,"Golf GPS devices have become increasingly popular among golfers looking to improve their game and there are many options available on the market today One convenient option is using an iPhone app that computes shot distances on any course in the world

These apps provide realtime updates regarding courses conditions as well as yardage information making them a great alternative to traditional handheld GPS devices or rangefinders There are several toprated golf GPS apps available across various platforms but when deciding which device is best suited for your needs its important to consider factors such as accuracy ease of use battery life and compatibility with other technology you may already own

"
C,218,MTBOT,"If you're looking to add a touch of elegance and sustainability to your outdoor space, solar-powered water features are an excellent option. Solar water fountains and bird baths are eco-friendly additions that bring beauty, tranquility, and sustainability to your garden. Powered by sunlight, these fountains create a mesmerizing ambiance with their gentle trickling sounds.

For those who have limited space in their gardens or balconies, small-sized fountain options can be placed inside bird baths. These compact fountains create calming sounds while attracting wildlife into your outdoor space. By incorporating these solar-powered features in your garden design, you'll enjoy both aesthetic appeal and environmental benefits since they don't require electricity from traditional sources like coal.

"
C,218,NMABOT,"Solar water features are a great way to add beauty and tranquility to your outdoor space while also being environmentally friendly. Solar-powered water fountains use the sun's energy to pump and circulate water, creating a relaxing atmosphere in your garden without relying on electricity or batteries. These low-maintenance features require minimal upkeep, making them an easy addition to any yard.

If you're looking for something that not only adds aesthetic appeal but also attracts wildlife, consider solar power bird baths. They provide both fresh drinking water and shelter for birds, encouraging more feathered friends into your backyard while reducing environmental impact by using sustainable energy sources.

For those with limited space or who prefer smaller options than traditional fountains or bird baths, there are compact-sized fountain designs specifically created for placing inside bird baths."
A,218,MTBOT,"Solar-powered water fountains and bird baths are a great addition to any outdoor space. They not only add an aesthetic appeal but also help conserve energy and water resources. If you're looking for a way to enhance your garden or patio, consider investing in these eco-friendly features.

For those interested in solar water fountains, there are many designs available that can suit different styles such as traditional, modern or contemporary. These fountains are powered by solar panels that convert sunlight into energy, making them cost-effective and low-maintenance.

Similarly, solar power bird baths provide birds with fresh drinking water and bathing opportunities while adding an aesthetic appeal to your yard. They come in various sizes and shapes making it easy for you to choose one that suits both yours and the birds' needs.

"
A,218,NMABOT,"Solar water fountains and solar power bird baths are ecofriendly and cost-effective features that can enhance the beauty of your garden or outdoor space. These features use renewable energy from the sun, making them low maintenance and sustainable.

A solar water fountain can create a relaxing atmosphere with its soothing sound of flowing water while being low maintenance due to not requiring electricity or batteries. They come in various designs that suit different styles such as traditional, modern, or contemporary depending on personal taste.

Similarly, a solar power bird bath provides birds with fresh drinking water and bathing opportunities while adding an aesthetic appeal to your yard. They come in various sizes and shapes making it easy for you to choose one that suits both yours and the birds' needs.

"
B,218,NMABOT,"Solar water fountains and bird baths are excellent additions to any garden or outdoor space. These features use solar power, a green source of energy that transforms sunlight into electricity, making them low maintenance and cost-effective options for adding beauty, sound, and wildlife to your surroundings.

Solar-powered water fountains create a relaxing atmosphere in your outdoor space with their calming trickle of running water while attracting birds, butterflies, hummingbirds and other wildlife. Solar-powered bird baths provide both shelter and clean drinking water which is essential especially during hot weather when natural sources may dry up quickly.

If you prefer something smaller than a fountain or bird bath but still attractive to feathered friends there are small water fountains specifically designed for placing in bird baths."
A,274,NMSBOT,"Golf is a sport that requires dedication and practice to master. If you're looking to improve your game, golf instruction can be incredibly helpful. There are many options available for golf lessons from certified professionals who specialize in teaching the basics of the game as well as advanced techniques.

For those seeking a more immersive experience, vacation packages that include golf instruction may be just what you need. These packages typically offer accommodations at resorts with access to top-notch courses and instructors who will help take your skills to the next level. You can even take golf lessons during your vacation if you don't have time for a full school beforehand.

When it comes to choosing a destination for your golf vacation package, there are several regions around the world known for their exceptional courses and stunning scenery."
A,274,NMTBOT,"Golf is a sport that requires skill and precision, and golf instruction can help you perfect your swing and take your game to the next level. Whether you're a beginner or an experienced player, attending a golf school with certified professionals can help you learn the basics of the game or build on your existing skills.

If you're looking for more than just learning how to play golf, many resorts offer vacation packages that include all aspects of improving your skills as well as opportunities for playing during your stay. This allows you to combine travel with improving on one of your favorite pastimes.

Some top destinations like Scandinavia countries and USA provide excellent courses with expert instruction making them ideal spots for combining travel with honing existing skills or even starting from scratch."
