group,query_id,username,text
C,204,NMABOT,"Golf is a sport that requires skill, patience, and strategy. Whether you are new to the game or an experienced player, understanding the rules of golf is essential for fair play and equity on both professional and recreational levels. The USGA Rules of Golf provide guidelines for competition outlining important information about playing procedures, etiquette, safety considerations, and other aspects of play.

For beginners seeking an overview of golf's basics, it's important to start with key concepts such as course layout, ball position, and types of shots like chip shot vs putt. Understanding handicaps and hazards like water sand traps can also improve your gameplay significantly. Practicing fundamentals including grip stance swing using different clubs will help prevent injury while enhancing performance.

"
C,204,NMSBOT,"Golf is a game that requires adherence to rules for fair play and competition. The USGA Rules of Golf provide guidelines for players on how the game should be played, including playing procedures, etiquette, safety considerations, and other aspects of play.

For beginners or those new to golf seeking an overview of the basics, it's important to understand course layout, ball position, types of shots such as chip shot versus putt, and handicap hazards like watersand traps. These fundamentals can help improve your overall score on the green.

The USGA website offers many resources for learning about golf rules and regulations as well as tips for improving your skills on the course."
A,204,NMABOT,"Golf is a sport that requires knowledge of the rules and regulations to ensure fair play. The USGA Rules of Golf are the official guidelines for playing golf designed to provide an equitable framework for competition at all levels. These rules cover various aspects of gameplay including etiquette, safety considerations, and playing procedures.

For beginners looking to learn about golf's basics, there are many resources available online through reputable sources like the USGA website. Some key concepts include understanding course layout, ball position on different types of shots (e.g., chip shot vs putt), handicap calculations, hazards such as water and sand traps.

It is important for players to follow these guidelines while practicing regularly with patience and perseverance in order to improve their skills over time. It takes practice to become skilled in hitting precise shots consistently.

"
A,204,NMSBOT,"Golf is a sport that has been played for centuries and it comes with its own set of rules The USGA Rules of Golf are the official PGA rules for golf and they provide a framework for competition at both professional and recreational levels These rules cover everything from playing procedure to etiquette to safety considerations

For beginners or those new to the game, understanding the basics of golf is essential This includes concepts such as course layout, ball position, types of shots (e.g. chip shot vs putt), understanding handicap, hazards (water/sand traps), etc. There are many resources available online through reputable sources like the USGA website that can help you learn more about these topics

"
D,204,NMABOT,"Golf is a sport that requires both knowledge of the rules and an understanding of its fundamentals. The USGA Rules of Golf provide essential guidelines to ensure fair play in competition, covering playing procedures, etiquette, safety considerations, and other aspects of the game.

For beginners or those new to golf looking for an overview of its basics, it's important to understand course layout and ball position. Knowing types of shots such as chip shot vs putt can also help improve your overall performance on the green. Additionally, understanding handicap hazards like water/sand traps will give you a better chance at success when facing challenging obstacles during gameplay.

"
D,204,NMSBOT,"Golf is a sport that has been played for centuries and has its own set of rules. The official PGA rules for golf are known as the USGA Rules of Golf, which ensure fair play on both professional and recreational levels.

For beginners or those new to the game looking for an overview of golf's basics, there are many resources available online through reputable sources like the USGA website. These resources provide information about key concepts such as course layout, ball position, types of shots (e.g., chip shot vs putt), understanding handicap, hazards (water/sand traps), etiquette, safety considerations and more.

The USGA Rules of Golf outline important information about playing procedure including how to determine penalties when they occur during gameplay."
B,204,NMABOT,"Golf is a sport that requires players to follow strict rules and regulations known as the USGA Rules of Golf. These rules ensure fair play and define how golf should be played on both professional and recreational levels. Understanding these rules is crucial for anyone looking to compete in this game.

For beginners or those new to the sport, an overview of golf's basics can help them understand key concepts such as course layout, ball position, types of shots (e.g., chip shot vs putt), understanding handicap hazards, water and traps etc. There are many resources available online through reputable sources like the USGA website where one can find tips for improving their skills.

To become proficient at golf takes time and practice; however, it is important not only to learn about playing procedures but also etiquette considerations."
B,204,NMSBOT,"Golf is a sport that requires knowledge of the rules and etiquette to play fairly and enjoyably. The USGA Rules of Golf provide comprehensive guidelines for players at all levels, ensuring fair play and equitable competition.

For beginners, understanding the basics of golf is essential. This includes learning about course layout, ball position, types of shots such as chip shot versus putt, and other key concepts that will help improve your skills over time.

In addition to these fundamentals, it's important to have an overview of golf etiquette when playing on the course. This includes being respectful towards other players by not talking during their swings or moving around while they're hitting. Safety considerations such as shouting ""fore"" when a ball is headed towards another player are also important aspects of golf etiquette.

"
B,210,NMABOT,"Golf GPS devices and apps have become increasingly popular among golfers who want to improve their game. One great option is using an iPhone app that computes shot distances on any course in the world. These apps provide real-time updates regarding course conditions as well as yardage information using GPS technology, making them a convenient alternative to traditional handheld GPS devices or rangefinders.

When deciding on a golf GPS device or app, it's important to consider factors such as accuracy, ease of use, battery life, and compatibility with other technology you may already own. There are several top-rated golf GPS apps available across various platforms, but iPhone apps have been proven to compute shot distances most accurately in the sport of golf.

"
D,218,MTBOT,"If you're looking to enhance the beauty of your garden or outdoor space while also promoting environmental sustainability, solar water fountains, solar power bird baths, and water fountain for bird bath are excellent options. These features use renewable energy sources from the sun's rays to circulate the water in a peaceful manner without requiring much maintenance.

Solar water fountains are an excellent choice for adding beauty and sound to your garden. These low-maintenance features use solar power to pump and circulate the water, creating a relaxing atmosphere in your outdoor space. They come in various sizes and designs that can fit any style preference.

Similarly, solar-powered bird baths provide both shelter and hydration for birds using clean energy sources."
D,218,NMABOT,"Solar water fountains and solar powered bird baths are excellent additions to any garden or outdoor space. These features use the sun's energy to pump and circulate water, creating a peaceful atmosphere without requiring much maintenance or ongoing electricity costs. 

In addition to their aesthetic value, solar powered bird baths provide birds with essential access to clean drinking water as well as shelter from predators. This makes them more likely to visit your yard, adding even more life and vitality to your garden.

If you're looking for something smaller than a full-size fountain or bird bath, consider getting a small water fountain specifically designed for placing in bird baths. It will attract wildlife with its calming trickle of running water while taking up minimal space in your garden.

"
B,218,MTBOT,"Solar water fountains are a great addition to any garden, providing both beauty and sound. These features use solar power to pump and circulate the water, creating a relaxing atmosphere in your outdoor space while also being eco-friendly and cost-effective. 

If you're looking for a way to attract birds to your garden, consider installing a solar-powered bird bath. These bird baths provide fresh drinking water for birds every day, especially during hot weather when natural sources may dry up quickly. They also offer shelter for birds, making them more likely to visit your yard. By using renewable energy from the sun, these bird baths are an affordable alternative to traditional powered options.

"
C,235,MTBOT,"Ham radio, also known as amateur radio, is a fascinating hobby that allows people to communicate with each other using specialized devices. However, before engaging in this activity, one must obtain permission from the Federal Communications Commission (FCC) by obtaining a license.

The FCC grants three different types of ham radio licenses: Technician Class License for beginners, General Class License for those who have advanced technical skills and Extra Class License for experienced operators seeking additional privileges. Each class has its own set of requirements but all applicants need to demonstrate their understanding of FCC regulations as well as proficiency in operating procedures used in ham radio communication.

To obtain any type of license, an individual needs to pass an exam covering topics such as basic electronics theory, operating practices and rules/regulations governing amateur radio communications."
C,235,NMTBOT,"Ham radio, also known as amateur radio, is a popular hobby that allows people to communicate with each other using specialized devices. However, in order to operate an Amateur Radio station legally, you need to obtain a ham radio license from the Federal Communications Commission (FCC). The FCC offers three different classes of licenses: Technician Class License for entry-level users, General Class License for those with more advanced technical skills and Extra Class License for experienced operators who want additional privileges.

Each class has its own requirements but all demand learning about theoretical aspects of ham radio operation and communication and about FCC regulations. In the end, each class requires passing an exam about the material taught."
D,235,MTBOT,"If you're interested in ham radio, it's important to know that a license is required to operate an Amateur Radio station. The Federal Communications Commission (FCC) grants several classes of licenses based on the user's experience and knowledge level. There are three main types of ham radio licenses: Technician Class Licenses for entry-level users, General Class Licenses for those with more advanced technical skills, and Extra Class Licenses for experienced operators who want additional privileges.

To obtain any type of ham radio license, applicants must pass a series of exams that test their understanding of FCC regulations as well as proficiency in operating procedures used in ham radio communication. These exams cover basic electronics theory including elements like circuits or signals.

"
D,235,NMTBOT,"Ham radio is a popular hobby that involves communication with other people using various types of equipment. However, before operating an Amateur Radio station, one must obtain a license from the Federal Communications Commission (FCC). The FCC grants several classes of licenses depending on the operator's experience and knowledge.

There are three main classes of ham radio licenses: Technician Class License for entry-level users, General Class License for those with more advanced technical skills, and Extra Class License for experienced operators who want additional privileges. Each class has its own requirements but all applicants need to demonstrate their understanding of FCC regulations as well as proficiency in operating procedures used in ham radio communication.

To obtain a Technician Class License, one needs to pass a written exam covering basic regulations and operating practices."
B,235,MTBOT,"Ham radio is a licensed noncommercial radio service that uses allocated frequencies not used by AM and FM. To operate an Amateur Radio station, one must have a ham radio license granted by the Federal Communications Commission (FCC). The FCC grants three classes of licenses based on users' experience and knowledge demonstrated through passing exams.

The Technician class license is the entry-level choice for most new ham operators. It requires passing one examination totaling 35 questions on radio theory, regulations, and operating practices. This license gives access to all Amateur Radio frequencies above 30 megahertz and allows for some limited privileges on HF.

The General class license opens up worldwide communication opportunities with another exam consisting of 35 questions. This license grants all operating privileges available except for those reserved for the Extra class.

"
B,235,NMTBOT,"Ham radio is a licensed noncommercial radio service that uses allocated frequencies not used by AM and FM broadcasts. To operate an Amateur Radio station, one must have a ham radio license granted by the Federal Communications Commission (FCC). There are three classes of licenses: Technician, General, and Extra.

The Technician class license is the entry-level option for most new operators who want access to all Amateur Radio frequencies above 30 megahertz with some limited privileges on HF. Passing an exam consisting of 35 questions about regulations, operating practices, and theory earns this license.

General class licenses require another exam containing 35 questions covering advanced technical skills such as worldwide communication capabilities using allocated frequencies not used by AM or FM broadcasts.

Earning the Extra class license is more difficult."
C,250,MSBOT,"The Ford Edge is a popular car model that has been on the market for several years. However, like any vehicle, it's not without its problems and disadvantages. One of the most significant issues reported by owners is poor engine performance, which can result in reduced fuel efficiency and overall power. This issue can be caused by a variety of factors, including faulty spark plugs or fuel injectors.

Another disadvantage of the Ford Edge is its faulty electrical system. Some drivers have experienced problems with their vehicle's electronics failing or malfunctioning over time. This can include issues with the radio, navigation system, or even the car's computer.

In terms of side effects, some drivers report noisy engines and brakes as well as uncomfortable seating positions inside the cabin area."
C,250,NMTBOT,"The Ford Edge car model has been known to have several problems, disadvantages, and negative side effects. Many drivers and consumers alike have experienced a variety of drawbacks such as poor engine performance, faulty electrical systems, suspension issues, mechanical failures, and other complications that can be costly to repair or replace.

Furthermore, many owners report experiencing side effects from their vehicle like noisy engines and brakes, uncomfortable seating positions in the cabin area as well as shuddering while turning at low speeds. These common complaints are concerning but not surprising considering the age range of most Edges on the road today.

Despite these setbacks associated with owning a Ford Edge car model which make it unrecommended by some experts due to its problems and disadvantages there are still good reasons why people choose this particular vehicle."
A,250,MSBOT,"The Ford Edge is a popular car model that has received mixed reviews from drivers and consumers. While some have reported problems with the engine performance, faulty electrical systems, suspension issues, and other complications that can be costly to repair or replace, others have had positive experiences with the vehicle.

One of the main disadvantages of owning a Ford Edge is its reported problems. Some drivers have complained about noisy engines and brakes, uncomfortable seating positions in the cabin area as well as shuddering while turning at low speeds. These common complaints are concerning because they affect the overall driving experience.

However, it's important to note that not all Edges suffer from these issues. Proper maintenance can prevent most of them from occurring altogether. Regular oil changes and tune-ups can help keep your Edge running smoothly for years to come.

"
A,250,NMTBOT,"The Ford Edge is a popular midsize SUV that has gained a lot of attention from car buyers. However, it's important to note some common problems associated with this vehicle before making a purchase decision.

Many drivers and consumers have reported experiencing various disadvantages such as poor engine performance, faulty electrical systems, suspension issues, mechanical failures and other complications which can be quite costly to repair or replace. These drawbacks could potentially cause frustration for the driver and affect their overall experience with the car.

In addition to these problems, many Edge owners also report side effects from their vehicle which may not necessarily pose danger yet still hinder the driving experience. Some of these include noisy engines and brakes, uncomfortable seating positions in the cabin area as well as shuddering while turning at low speeds.

"
D,250,MSBOT,"The Ford Edge is a popular car model that has received mixed reviews from drivers and consumers. While it offers many benefits, there are also some problems and disadvantages to consider.

One of the most common issues reported by Edge owners is engine problems. Some have experienced poor performance, while others have had to deal with faulty electrical systems or suspension issues. These complications can be costly to repair or replace, which can be frustrating for those who own this car.

In addition to these disadvantages, some drivers report side effects from their vehicle such as noisy engines and brakes, uncomfortable seating positions in the cabin area, as well as shuddering while turning at low speeds. These complaints are concerning but not surprising considering the age range of most Edges on the road today.

"
D,250,NMTBOT,"The Ford Edge car model has been known to have its fair share of problems. Many drivers and consumers alike have experienced a variety of issues such as poor engine performance, faulty electrical systems, suspension problems, mechanical failures and other complications that can be costly to repair or replace. These disadvantages are concerning for anyone considering purchasing an Edge.

Furthermore, many Edge owners report side effects from their vehicle such as noisy engines and brakes, uncomfortable seating positions in the cabin area and shuddering while turning at low speeds. These common complaints highlight some design flaws with this particular model.

It is important to note that these concerns are not unique to the Ford Edge alone; every car brand has had its own set of challenges over time."
B,250,MSBOT,"If you're considering purchasing a Ford Edge, it's important to be aware of some potential problems and disadvantages. Some drivers have reported issues with the engine performance, electrical systems, suspension, and other mechanical failures that can be costly to repair. However, it's worth noting that not all models experience these problems.

In addition to these issues, some Ford Edge owners have reported side effects such as noisy engines and brakes, uncomfortable seating positions in the cabin area, and shuddering while turning at low speeds. While these complaints are concerning for those who own an Edge vehicle, they don't necessarily apply to all models.

Despite these challenges faced by some Ford Edge owners, there are still plenty of features and benefits worth considering. The car offers a spacious interior with comfortable seating for up to five passengers."
B,250,NMTBOT,"The Ford Edge is a popular midsize SUV that has been on the market since 2007. While it offers a spacious cabin area and comfortable ride quality, there have been some reported problems with this model. Common issues include poor engine performance, faulty electrical systems, suspension problems, and mechanical failures which can be expensive to repair or replace.

In addition to these concerns, many owners report side effects such as noisy engines and brakes or uncomfortable seating positions in the cabin area. Shuddering while turning at low speeds is another common complaint from Edge drivers.

To address these issues, it's important to follow a regular maintenance schedule for your Ford Edge. This can help prevent premature wear or damage to the vehicle's parts and keep it running smoothly over time.

"
C,233,MABOT,"When it comes to hair dye and pregnancy, it's important to prioritize safety. While there is no definitive research on how hair dyes affect pregnancy outcomes, some experts suggest avoiding commercial hair dyes while pregnant. The chemicals in traditional hair dyes can be absorbed through the skin and into the bloodstream, which could potentially harm an unborn child.

If you must use a commercial product, consider an all-natural or vegetable-based one like Naturtint instead of harsher chemical dyes that contain ammonia or peroxide. It's also recommended that expecting mothers do not apply the dye directly onto their scalp and instead have someone else perform the job for them in order to reduce risk of exposure.

"
C,233,MSBOT,"When it comes to hair dye and pregnancy, there are a few things to keep in mind. While there is no definitive evidence that hair dye is harmful during pregnancy, some experts suggest avoiding commercial dyes altogether. The chemicals in traditional hair dyes can be absorbed through the skin and into the bloodstream, which could potentially harm an unborn child.

If you do choose to dye your hair while pregnant, it's important to take extra precautions. Consider using an all-natural or vegetable-based product like Naturtint instead of harsher chemical dyes that contain ammonia or peroxide. It's also recommended that expecting mothers do not apply the dye directly onto their scalp and instead have someone else perform the job for them in order reduce risk of exposure.

"
A,233,MABOT,"Pregnancy is a time when women need to be extra cautious about what they put in their bodies, including hair dye. While there are no definitive studies that show how hair dyes affect pregnancy outcomes, it is still best to err on the side of caution and avoid using commercial hair dyes while pregnant.

Chemical dyes contain ammonia or peroxide which can potentially harm both mother and fetus. If you must use a commercial product, try an all-natural or vegetable-based one like Naturtint instead. It is also recommended that expecting mothers do not apply the dye directly onto their scalp and have someone else perform the job for them in order reduce risk of exposure.

"
A,233,MSBOT,"Hair dye is a popular cosmetic product used by many people to change their hair color. However, for pregnant women, there are concerns about the safety of using hair dye during pregnancy. While there is no conclusive evidence that hair dye can harm the fetus, it's best to be cautious and avoid using chemical-based dyes.

Chemical dyes contain harmful ingredients such as ammonia and peroxide that can potentially harm both the mother and fetus. Instead, pregnant women should opt for natural or vegetable-based dyes like henna or indigo. These products are safe to use during pregnancy and do not contain any harmful chemicals.

It's also important to note that pregnant women should avoid applying hair dye directly onto their scalp as this increases the risk of exposure to harmful chemicals."
D,233,MABOT,"If you're pregnant and considering dying your hair, it's important to take extra precautions. While there are no definitive studies that show how hair dyes affect pregnancy outcomes, it is still best to avoid using commercial hair dyes while pregnant. Instead, try an all-natural or vegetable-based dye like Naturtint as opposed to harsher chemical dyes which contain ammonia or peroxide.

It is also recommended that expecting mothers do not apply the dye directly onto their scalp and instead have someone else perform the job for them in order reduce risk of exposure. If you must use a commercial product, make sure to follow instructions carefully and ensure proper ventilation during application.

In addition, some women may experience changes in their hair texture or color during pregnancy due to hormonal fluctuations."
