group,query_id,username,text
A,249,MTBOT,"Occupational therapy is a vital healthcare profession that helps individuals with physical, mental, or social challenges to participate in daily life activities. If you're interested in becoming an occupational therapist, there are specific qualification requirements that you must meet to excel in this field.

To become an occupational therapist, you'll need to complete a Master's degree program in occupational therapy from an institution accredited by either the American Occupational Therapy Association (AOTA) or the Accreditation Council for Occupational Therapy Education (ACOTE). Depending on your location, additional coursework and fieldwork hours may be required.

Once you've completed all necessary qualifications and education requirements, you can apply for licensure from the board of occupational therapy within your jurisdiction to become a fully certified practitioner."
A,249,NMSBOT,"Occupational therapy is a healthcare profession that helps people with physical, mental, or social challenges to participate in daily life activities. Occupational therapists work to improve the quality of life and independence for those who have disabilities.

To become an occupational therapist, you will need to meet certain qualification requirements based on your state/country regulations. Typically, this involves completing a Master's degree program approved by either AOTA (American Occupational Therapy Association) or ACOTE (Accreditation Council for Occupational Therapy Education). Depending on where you live, additional courses and fieldwork hours may also be required before becoming qualified.

If you're interested in becoming an occupational therapist, it's important to know the steps involved. First, research the specific qualifications required in your area."
D,249,MTBOT,"Occupational therapy is a healthcare profession that focuses on helping individuals overcome physical, mental, or social challenges by facilitating their participation in daily activities and improving their overall wellbeing. To become an occupational therapist, it is essential to fulfill the necessary qualifications required by your state or country.

One of the most common queries regarding occupational therapy is about the qualification requirements. Typically, this entails completing an AOTA or ACOTE-approved Masters degree program. Practical experience gained through supervised clinical internships is also invaluable for honing the essential skills required in this field.

Another common query is how to become an occupational therapist. After fulfilling all educational requirements and gaining practical experience through internships, aspiring occupational therapists must apply for licensure from the board governing occupational therapy in their intended practice area.

"
D,249,NMSBOT,"Occupational therapy is a healthcare profession that helps individuals with physical, mental, or social challenges participate in daily life activities. Occupational therapists work to improve their clients' quality of life and help them become as independent as possible.

To become an occupational therapist, you must meet specific qualification requirements set by your state/country. Typically, this involves completing a Master's degree program approved by either AOTA (American Occupational Therapy Association) or ACOTE (Accreditation Council for Occupational Therapy Education). Depending on where you live, additional courses and fieldwork hours may be required before becoming qualified.

If you're interested in becoming an occupational therapist, it's important to know the steps involved in the process. You can start by researching the qualifications required in your area and finding an accredited program that meets those requirements."
B,249,MTBOT,"Occupational therapy is a healthcare profession that focuses on helping individuals with physical, mental, developmental, and emotional challenges to participate in daily life activities. If you're interested in becoming an occupational therapist, there are certain qualifications you'll need to meet.

The minimum requirement for becoming an occupational therapist usually includes completing a master's degree program approved by either the American Occupational Therapy Association (AOTA) or the Accreditation Council for Occupational Therapy Education (ACOTE). Depending on where you live, additional courses and fieldwork hours may also be required before becoming qualified.

Once all requirements are met, applicants can apply for licensure from the board of occupational therapy within their jurisdiction to become fully certified practitioners."
B,249,NMSBOT,"Occupational therapy is a healthcare profession that helps individuals with physical, mental, or social challenges to participate in daily life activities and improve their quality of life. To become an occupational therapist, one must meet the qualification requirements set by their state/country's regulatory body.

The minimum requirement usually includes completing a Master's degree program approved by either AOTA (American Occupational Therapy Association) or ACOTE (Accreditation Council for Occupational Therapy Education). However, additional courses and fieldwork hours may also be required depending on where you live.

In addition to meeting the educational requirements, applicants must apply for licensure from the board of occupational therapy within the jurisdiction they plan to practice in order to become certified practitioners."
C,262,MSBOT,"If you're struggling with balding and looking for help, there are a variety of options available to you. One common approach is to seek out balding cures, such as minoxidil or finasteride. These medications work by promoting hair growth and preventing further loss, and have been clinically proven to be effective in treating male pattern baldness.

However, if you're looking for natural remedies, there are also several options worth considering., massaging essential oils into your scalp can help promote hair growth and improve overall hair health. Additionally, increasing your intake of certain vitamins and minerals - like biotin or zinc - can also be beneficial.

If you're dealing with a bald spot on the top of your head specifically, there are some additional steps you can take."
C,262,NMSBOT,"Balding is a common issue that many people face, but there are various options available to help. One potential solution is finding a cure for baldness, which may involve medications or hair transplants. However, if you're looking for more natural remedies to address the issue of bald spots on your head, home remedies may be worth exploring.

Some possible home remedies include massaging essential oils and scalp-boosting products into the scalp. Over-the-counter lotions containing minoxidil have also been shown to promote hair growth in some cases. Additionally, maintaining a healthy diet rich in proteins and vitamins while cutting back on sugar intake could potentially aid in preventing further hair loss.

"
A,262,MSBOT,"Dealing with balding and bald spots can be a frustrating experience, but there are several options available to help address these issues. One approach is to explore home remedies such as essential oil massages and scalp-boosting products. These natural treatments can be effective in promoting hair growth by stimulating blood flow to the scalp and providing nutrients to hair follicles.

Over-the-counter lotions containing minoxidil have also been shown to stimulate hair regrowth, making them another viable option for those looking for a solution. However, it's important to note that results may vary depending on the individual.

For those seeking more advanced solutions, medical treatments may provide relief from baldness. Platelet-rich plasma therapy involves injecting platelets into the scalp which can trigger natural hair growth."
A,262,NMSBOT,"Baldness is a common concern for many people, but there are several options available to help combat it. Hair replacement through transplants or wigs is one option that many people consider. However, there are also various home remedies and treatments that can be used as cures for balding and to reduce the appearance of bald spots on top of the head.

One effective treatment includes using essential oils like rosemary oil, which has been shown to promote hair growth by stimulating blood circulation in the scalp area when massaged into it regularly. Additionally, over-the-counter lotions containing minoxidil may also help reduce hair loss and stimulate new growth.

Maintaining a healthy diet rich in proteins and vitamins such as iron and biotin can also aid in preventing further hair loss while promoting regrowth."
D,262,MSBOT,"Balding is a common problem that affects many people, but there are various solutions available to help combat it. If you're looking for a balding cure, there are several options to consider. One effective solution for bald spot treatment is the use of essential oils and scalp-boosting products which can be massaged into the scalp to stimulate hair growth.

Another option includes over-the-counter lotions with minoxidil as an active ingredient which has been shown to promote hair regrowth. However, these remedies may not work for everyone and results vary from person to person.

If you're looking for help with a bald spot on top of your head, there are also home remedies that may be worth trying."
D,262,NMSBOT,"Balding is a common issue that affects many individuals, but there are various treatments available to help reduce the appearance of bald spots on top of the head and even cure baldness altogether. Home remedies such as massaging essential oils or using over-the-counter lotions with minoxidil can be effective in promoting hair growth. Additionally, maintaining a healthy diet rich in proteins and vitamins while reducing sugar intake may also aid in preventing further hair loss.

It's important to consult with your doctor about potential therapies they may recommend based on individual symptoms. Hair replacement options like wigs or transplants are also viable solutions for those seeking more immediate results.

When it comes to finding help for bald spot on top of head, it's important to understand that there is no one-size-fits-all solution."
B,262,MSBOT,"If you're struggling with hair loss, there are several options available to help you find relief. One of the most effective balding cures is medication, such as minoxidil and finasteride. These treatments work by blocking the hormone responsible for hair loss and promoting new hair growth.

However, if you're looking for help with a bald spot on top of your head specifically, there are also home remedies that may be worth trying. Essential oils like peppermint oil and rosemary oil have been shown to stimulate hair growth when applied directly to the scalp. Additionally, onion juice mixed with honey or coconut oil can also be applied topically to promote new hair growth.

It's important to note that while these home remedies may be helpful in some cases, they aren't guaranteed solutions for everyone."
B,262,NMSBOT,"Dealing with balding can be a challenging experience, but there are various options available to help. One of the most popular is finding a cure for baldness. While hair replacement methods like wigs or transplants may seem like the only solutions, there are also several treatments that can be used as balding cures or to reduce the appearance of a bald spot on top of your head.

Some home remedies include massaging essential oils and scalp-boosting products into your scalp, using over-the-counter lotions with minoxidil, eating more healthy proteins and vitamins, and cutting back on sugar intake. These natural remedies have been known to stimulate hair growth in some people.

However, it's important to note that not all types of hair loss can be treated at home."
C,272,MTBOT,"Dream interpretation is a fascinating and complex subject that has intrigued many experts in psychology. Dreams are thought to be symbolic representations of our innermost thoughts, feelings, and behaviors in the waking world. By exploring their hidden messages, we can gain valuable insights into our unconscious minds.

Recurring dreams may indicate underlying issues that need to be resolved regardless of their content. Research suggests that adults who experience frequent recurring dreams tend to have worse psychological health. These dreams could be a way for us to work through incomplete needs or process trauma.

When interpreting your dreams, it's essential to ask yourself questions like what you were feeling when this dream happened or how does it relate to your current situation. Understanding these meanings behind your unconscious mind's messages will help you better understand yourself and promote personal growth.

"
C,272,MABOT,"Dream interpretation is a fascinating and complex subject that has intrigued many experts in psychology. Dreams are thought to be symbolic representations of our innermost thoughts, feelings, and behaviors in the waking world. By exploring their hidden messages, we can gain valuable insights into our unconscious minds.

Recurring dreams often indicate something that has been left unresolved or a repeating pattern of behavior in daily life. Research suggests that adults who experience frequent recurring dreams tend to have worse psychological health. These dreams could be a way for us to work through incomplete needs or process trauma.

When interpreting your dreams, it's essential to ask yourself questions like what you were feeling when this dream happened or how does it relate to your current situation. Understanding these meanings behind your unconscious mind's messages will help you better understand yourself and promote personal growth.

"
A,272,MTBOT,"Dream interpretation is a fascinating subject that has intrigued people for centuries. Many people wonder what their dreams mean, especially recurring dreams, and what the subconscious is trying to tell them. Understanding the meaning behind these dreams can provide valuable insight into unresolved issues or patterns in daily life.

When interpreting dreams, it is essential to consider your emotions during the dream and how it relates to your current situation. Psychologists may help decipher these messages by linking them to patients' ideas and subconscious thoughts. However, ultimately the meaning of a dream is unique to each individual and requires ongoing self-discovery.

Recurring dreams hold powerful insights as they often indicate unresolved issues or emotions that need attention. It's important not only to pay attention but also track any patterns or changes in these dreams over time using a dream journal.

"
A,272,MABOT,"Dream interpretation is a fascinating and complex subject that has captivated people for centuries. Many wonder about the meaning of dreams, particularly recurring ones, and what they reveal about our subconscious. Understanding the meaning behind these dreams can provide valuable insight into unresolved issues or patterns in daily life.

When interpreting dreams, it's essential to consider your emotions during the dream and how they relate to your current situation. Psychologists may help decipher these messages by linking them to patients' ideas and subconscious thoughts. However, ultimately the meaning of a dream is unique to each individual and requires ongoing self-discovery.

Recurring dreams hold powerful insights as they often indicate unresolved issues or emotions that need attention. It's important not only to pay attention but also track any patterns or changes in these dreams over time using a dream journal.

"
D,272,MTBOT,"Dream interpretation is a fascinating and complex subject that can provide insight into our subconscious mind. Dreams are believed to be symbolic representations of our thoughts, feelings, and behaviors in the waking world. By analyzing recurring dreams, we may uncover unresolved issues or patterns of behavior that need attention.

To interpret dreams effectively, it's essential to consider your emotions during the dream and how they relate to your current situation. For instance, if you frequently dream about falling from great heights, this could indicate anxiety or fear related to something happening in your life.

Recurring dreams often have significant meaning and should not be ignored. They may represent an opportunity for personal growth by addressing underlying fears or emotional conflicts. Understanding what do dreams mean requires self-reflection and introspection as well as seeking guidance from experts on interpreting them.

"
D,272,MABOT,"Dream interpretation is a fascinating and complex subject that can provide insight into our subconscious mind. Dreams are believed to be symbolic representations of our thoughts, feelings, and behaviors in the waking world. By analyzing recurring dreams, we may uncover unresolved issues or patterns of behavior that need attention.

To interpret dreams effectively, it's essential to consider your emotions during the dream and how they relate to your current situation. For instance, if you frequently dream about falling from great heights, this could indicate anxiety or fear related to something happening in your life. Another common recurring dream is losing teeth which could signify anxiety around loss or change.

Recurring dreams often have significant meaning and should not be ignored. They may represent an opportunity for personal growth by addressing underlying fears or emotional conflicts."
B,272,MTBOT,"Dream interpretation is a fascinating subject that can provide valuable insights into our subconscious minds. Dreams are often symbolic and can reveal how we process our thoughts, feelings, and behaviors in the waking world. Understanding what dreams mean requires an exploration of their deeper meanings.

Recurring dreams are particularly interesting as they may indicate unresolved issues or patterns of behavior in daily life. By paying attention to the emotions experienced during these recurring dreams and exploring how they relate to current situations, individuals can gain valuable insights about themselves.

To interpret your dreams effectively, it's important to understand that dream symbolism tends to be highly individualized. However, there are some common themes and symbols that appear across cultures and time periods. For example, dreaming about falling may represent a fear of failure or loss of control.

"
B,272,MABOT,"Dream interpretation is a fascinating and complex field that can offer valuable insight into our subconscious minds. Dreams are often symbolic, reflecting how we process our thoughts, feelings, and behaviors in the waking world. Understanding what dreams mean requires an exploration of their deeper meanings.

Recurring dreams are particularly interesting as they may indicate unresolved issues or patterns of behavior in daily life. By paying attention to the emotions experienced during these recurring dreams and exploring how they relate to current situations, individuals can gain valuable insights about themselves.

When it comes to interpreting dreams, there is no one-size-fits-all approach since dream symbolism tends to be highly individualized. However, asking oneself questions such as ""what was I feeling when this dream happened?"" or ""how does it relate to my current situation?"
C,296,MABOT,"Recycling lead acid batteries is crucial for protecting the environment and conserving resources. If you're wondering where to dispose of old car batteries, it's important to do so responsibly. Many auto parts stores and waste facilities offer recycling programs for used batteries, but it's essential to research what services your area provides before attempting any DIY approach.

To find the nearest waste disposal location for batteries, contact your local government or use online directories. Most communities have information about recycling centers or hazardous waste disposal sites that accept used automotive batteries for proper disposal or recycling. You may also be able to find a nearby store specializing in selling and disposing of these types of products, as well as auto repair shops that can help with finding safe ways to get rid of them.

"
C,296,MSBOT,"If you're looking for information on how to properly dispose of lead acid batteries, you've come to the right place. These batteries are commonly used in cars and other vehicles, but they can be harmful to the environment if not disposed of properly.

The first step in recycling lead acid batteries is to find a recycling center near you. Many local government websites provide information about recycling centers or hazardous waste disposal sites that accept used automotive batteries for proper disposal or recycling.

When it comes to old car batteries, it's essential to find a safe way to dispose of them rather than throwing them away with regular household trash. One option is to take them back to the store where you purchased your new battery. Many stores specialize in selling and disposing of these types of products.

"
A,296,MABOT,"Recycling lead acid batteries is crucial for protecting the environment and conserving resources. These batteries are commonly used in cars, backup power supplies, and solar power systems but contain harmful chemicals like lead and sulfuric acid that can be hazardous to the environment if not disposed of properly.

To find where to dispose old car battery safely, there are several options depending on location. In most communities, local government websites provide information about recycling centers or hazardous waste disposal sites near you that accept used automotive batteries for proper disposal or recycling. It may also be possible to find a nearby store specializing in selling and disposing these types of products as well as businesses like auto repair shops.

"
A,296,MSBOT,"Recycling lead acid batteries is an important step towards protecting the environment. This includes old car batteries, which are a type of lead-acid battery that should be recycled rather than disposed of in regular household waste. But where can you dispose of old car batteries?

The first step is to check with your local government website for information on recycling centers or hazardous waste disposal sites near you that accept used automotive batteries for proper disposal or recycling. It's essential to research what services your area provides before attempting any kind of DIY approach when it comes to safely disposing lead-acid batteries such as car ones.

Another option is to find a nearby store specializing in selling and disposing these types of products, as well as businesses like auto repair shops."
D,296,MABOT,"Recycling lead acid batteries, including old car batteries, is crucial for reducing waste and protecting the environment. If you're wondering where to dispose of old car batteries or any other type of lead acid battery, there are several options available depending on your location.

Most communities have local government websites that provide information about recycling centers or hazardous waste disposal sites near you that accept used automotive batteries for proper disposal or recycling. You can also check with stores specializing in selling and disposing of these products as well as auto repair shops which may offer safe ways to get rid of them.

It's important to research what services your area provides before attempting any kind of DIY approach when it comes to safely disposing lead-acid batteries such as those found in cars."
D,296,MSBOT,"When it comes to recycling lead acid batteries and disposing of old car batteries, it's important to know the proper methods to protect both the environment and your health. The good news is that there are several options available for safely getting rid of these types of batteries.

Firstly, recycling lead acid batteries is crucial as they contain toxic chemicals that can harm the environment if not disposed of properly. Many communities have local recycling centers or hazardous waste disposal sites that accept used automotive batteries for proper recycling or disposal. You can also check with stores specializing in selling and disposing of these products as well as auto repair shops which may offer safe ways to get rid of them.

Secondly, if you're wondering where to dispose old car batteries, there are several options available depending on your location."
B,296,MABOT,"Recycling lead acid batteries is not only important for protecting the environment but also for reducing waste. If you have an old car battery, it's crucial to dispose of it properly instead of throwing it in regular household trash. But where can you find the nearest waste disposal facility that accepts used automotive batteries?

The first step is to check your local government website for information about recycling centers or hazardous waste disposal sites near you. These facilities will accept old car batteries for proper disposal or recycling. You may also be able to find nearby stores specializing in selling and disposing these types of products as well as businesses like auto repair shops which can help with finding safe ways to get rid of them.

It's essential not only to recycle but also reuse materials whenever possible."
